{
  "schema_version": "svetlost33-saints-1",
  "version": "2026.9.19",
  "revision": 1,
  "approval_id": "saints-pilot-2026-09-19-owner-r1",
  "review_status": "approved",
  "authorship": {
    "kind": "editorial_summary",
    "assistance": "ai",
    "attribution": {
      "sr-Cyrl": "Уреднички сажетак припремљен уз помоћ AI, према наведеним црквеним изворима. Није званично црквено одобрен текст.",
      "sr-Latn": "Urednički sažetak pripremljen uz pomoć AI, prema navedenim crkvenim izvorima. Nije zvanično crkveno odobren tekst."
    },
    "clerical_review": null
  },
  "calendar_binding": {
    "module_id": "calendar-2026-r1",
    "version": "2026.1.1",
    "revision": 2,
    "path": "data/calendar.2026.json",
    "sha256": "a1b6a5d5911ae03f77802bd466227f0c1ea4fe97708b1b6f92cd4b08847c7c9c"
  },
  "sources": [
    {
      "id": "eparhija-month-09",
      "kind": "calendar",
      "title": "Епархија аустријска СПЦ — календар",
      "url": "https://www.eparhija.at/kalendar?m=2026-9",
      "publisher": "Епархија аустријска Српске православне цркве",
      "original_author": null,
      "published_on": null,
      "reviewed_on": "2026-09-19"
    },
    {
      "id": "mcp-michael-chonae-2026",
      "kind": "article",
      "title": "Чудо Светог архангела Михаила у Хони",
      "url": "https://mitropolija.com/2026/09/18/cudo-svetog-arhangela-mihaila-u-honi-4/",
      "publisher": "Митрополија црногорско-приморска",
      "original_author": null,
      "published_on": "2026-09-18",
      "reviewed_on": "2026-09-19"
    },
    {
      "id": "mcp-sozont-2025",
      "kind": "article",
      "title": "Свети мученик Созонт",
      "url": "https://mitropolija.com/2025/09/19/sveti-mucenik-sozont/",
      "publisher": "Митрополија црногорско-приморска",
      "original_author": null,
      "published_on": "2025-09-19",
      "reviewed_on": "2026-09-19"
    },
    {
      "id": "spc-nativity-2021",
      "kind": "article",
      "title": "Рођење Пресвете Богородице - почетак истинске радости",
      "url": "https://spc.rs/sr/news/4444.rodenje-presvete-bogorodice---pocetak-istinske-radosti.html",
      "publisher": "Информативна служба Српске православне цркве",
      "original_author": "катихета Бранислав Илић",
      "published_on": "2021-09-21",
      "reviewed_on": "2026-09-19"
    },
    {
      "id": "spc-joachim-anna-2025",
      "kind": "article",
      "title": "Свети праведни богородитељи Јоаким и Ана",
      "url": "https://spc.rs/sr/news/14829.sveti-pravedni-bogoroditelji-joakim-i-ana-.html",
      "publisher": "Информативна служба Српске православне цркве",
      "original_author": null,
      "published_on": "2025-09-22",
      "reviewed_on": "2026-09-19"
    },
    {
      "id": "spc-three-sisters-2022",
      "kind": "article",
      "title": "Свете мученице Минодора, Митродора и Нимфодора",
      "url": "https://spc.rs/sr/news/8121.svete-mucenice-minodora%2C-mitrodora-i-nimfodora.html",
      "publisher": "Информативна служба Српске православне цркве",
      "original_author": null,
      "published_on": "2022-09-23",
      "reviewed_on": "2026-09-19"
    },
    {
      "id": "spc-theodora-2025",
      "kind": "article",
      "title": "Преподобна Теодора Александријска",
      "url": "https://www.spc.rs/sr/news/10067.prepodobna-teodora.html",
      "publisher": "Информативна служба Српске православне цркве",
      "original_author": null,
      "published_on": "2025-09-24",
      "reviewed_on": "2026-09-19"
    },
    {
      "id": "mcp-autonomus-2025",
      "kind": "article",
      "title": "Свети свештеномученик Автоном",
      "url": "https://mitropolija.com/2025/09/24/sveti-svestenomucenik-avtonom-2/",
      "publisher": "Митрополија црногорско-приморска",
      "original_author": null,
      "published_on": "2025-09-24",
      "reviewed_on": "2026-09-19"
    },
    {
      "id": "spc-autonomus",
      "kind": "article",
      "title": "Свети свештеномученик Автоном",
      "url": "https://www.spc.rs/sr/news/11761.sveti-svestenomucenik-avtonom.html",
      "publisher": "Информативна служба Српске православне цркве",
      "original_author": null,
      "published_on": null,
      "reviewed_on": "2026-09-19"
    }
  ],
  "articles": [
    {
      "id": "michael-miracle-chonae",
      "revision": 1,
      "type": "feast",
      "subtype": "commemoration_of_event",
      "source_ids": [
        "mcp-michael-chonae-2026"
      ],
      "content": {
        "sr-Cyrl": {
          "title": "Чудо Светог архангела Михаила у Хони",
          "intro": "Спомен избављења храма у Хони и молитве његовог чувара Архипа. Црквено предање приповеда о помоћи Светог архангела Михаила пред надолазећом водом.",
          "body": [
            "Предање овај догађај смешта у Фригију, код храма посвећеног Светом архангелу Михаилу. Уз храм је био извор, а о светињи се старао Архип, чији је живот описан као истрајно служење Богу и ближњима.",
            "Противници су намеравали да усмере воду двеју река према храму и униште га. Архип се у опасности обратио Богу молитвом. Према предању, јавио се архангел Михаило, а вода је скренута у раселину стене. Храм и његов чувар били су сачувани.",
            "После избављења Архип је заблагодарио Богу и наставио да служи при храму. Са овим догађајем предање повезује назив Хони, који упућује на понирање воде. Данашњим споменом Црква чува сећање на ово избављење и помоћ архангела Михаила."
          ],
          "takeaway": "У средишту приповести су молитва у невољи, верност служењу и благодарност за примљену помоћ."
        },
        "sr-Latn": {
          "title": "Čudo Svetog arhangela Mihaila u Honi",
          "intro": "Spomen izbavljenja hrama u Honi i molitve njegovog čuvara Arhipa. Crkveno predanje pripoveda o pomoći Svetog arhangela Mihaila pred nadolazećom vodom.",
          "body": [
            "Predanje ovaj događaj smešta u Frigiju, kod hrama posvećenog Svetom arhangelu Mihailu. Uz hram je bio izvor, a o svetinji se starao Arhip, čiji je život opisan kao istrajno služenje Bogu i bližnjima.",
            "Protivnici su nameravali da usmere vodu dveju reka prema hramu i unište ga. Arhip se u opasnosti obratio Bogu molitvom. Prema predanju, javio se arhangel Mihailo, a voda je skrenuta u raselinu stene. Hram i njegov čuvar bili su sačuvani.",
            "Posle izbavljenja Arhip je zablagodario Bogu i nastavio da služi pri hramu. Sa ovim događajem predanje povezuje naziv Honi, koji upućuje na poniranje vode. Današnjim spomenom Crkva čuva sećanje na ovo izbavljenje i pomoć arhangela Mihaila."
          ],
          "takeaway": "U središtu pripovesti su molitva u nevolji, vernost služenju i blagodarnost za primljenu pomoć."
        }
      }
    },
    {
      "id": "martyr-sozont",
      "revision": 1,
      "type": "saint",
      "subtype": null,
      "source_ids": [
        "mcp-sozont-2025"
      ],
      "content": {
        "sr-Cyrl": {
          "title": "Свети мученик Созонт",
          "intro": "Млади пастир из Ликаоније кога Црква памти као мученика. Његово житије истиче веру, доброчинство и спремност да други не страдају због њега.",
          "body": [
            "Према житију, Созонт је био хришћанин из Ликаоније и бавио се чувањем оваца. Док је радио, другим пастирима је говорио о Богу и упознавао их са хришћанском вером.",
            "Приповест га потом доводи у Помпеопољ у Киликији. Тамо је одломио део златног идола и злато разделио сиромашнима. Када су власти почеле да траже кривца и кажњавају друге, сам се пријавио, не желећи да они страдају због његовог поступка.",
            "Пред управником је исповедио веру у Христа и није пристао да је се одрекне. Житије описује његово мученичко страдање и поштовање које су му потом указали хришћани. Верни су сахранили његово тело, а касније је подигнута и црква посвећена његовом спомену."
          ],
          "takeaway": "Одговорност за сопствене поступке и брига да други не сносе њихове последице."
        },
        "sr-Latn": {
          "title": "Sveti mučenik Sozont",
          "intro": "Mladi pastir iz Likaonije koga Crkva pamti kao mučenika. Njegovo žitije ističe veru, dobročinstvo i spremnost da drugi ne stradaju zbog njega.",
          "body": [
            "Prema žitiju, Sozont je bio hrišćanin iz Likaonije i bavio se čuvanjem ovaca. Dok je radio, drugim pastirima je govorio o Bogu i upoznavao ih sa hrišćanskom verom.",
            "Pripovest ga potom dovodi u Pompeopolj u Kilikiji. Tamo je odlomio deo zlatnog idola i zlato razdelio siromašnima. Kada su vlasti počele da traže krivca i kažnjavaju druge, sam se prijavio, ne želeći da oni stradaju zbog njegovog postupka.",
            "Pred upravnikom je ispovedio veru u Hrista i nije pristao da je se odrekne. Žitije opisuje njegovo mučeničko stradanje i poštovanje koje su mu potom ukazali hrišćani. Verni su sahranili njegovo telo, a kasnije je podignuta i crkva posvećena njegovom spomenu."
          ],
          "takeaway": "Odgovornost za sopstvene postupke i briga da drugi ne snose njihove posledice."
        }
      }
    },
    {
      "id": "nativity-theotokos",
      "revision": 1,
      "type": "feast",
      "subtype": "feast",
      "source_ids": [
        "spc-nativity-2021"
      ],
      "content": {
        "sr-Cyrl": {
          "title": "Рођење Пресвете Богородице – Мала Госпојина",
          "intro": "Мала Госпојина је празник рођења Пресвете Богородице. Црква у њему прославља почетак радости повезане са доласком Христа у свет.",
          "body": [
            "Празник је посвећен рођењу Дјеве Марије, коју Црква поштује као Богородицу. Предање говори о њеним родитељима, Јоакиму и Ани, њиховој дугој молитви и радости због рођења кћери.",
            "Сведочанство о овом рођењу не налази се у јеванђелским приповестима, већ је сачувано у црквеном предању. Зато детаље о породици и детињству Богородице треба читати као део тог предања.",